<?xml version="1.0" encoding="UTF-8" standalone="no"?>

<!DOCTYPE transcription SYSTEM "http://www.livesandletters.ac.uk/schema/aor_20141023.dtd">

<transcription xmlns:xsi="http://www.w3.org/2001/XMLSchema-instance"
    xsi:noNamespaceSchemaLocation="https://raw.githubusercontent.com/ChrisRG/ReadingHamlet/master/RHschema.xsd">
    
    <page filename="Hamlet.026r.tif" pagination="51" signature="III.3" reader="John Ward"/> <!-- Signature = act + scene -->
    <annotation>
        <!-- Marginalia --> 	<!-- Positions available: head, intext, tail, left_margin, right_margin -->
        <marginalia>
            <language ident="EN">
                <position place="right_margin" book_orientation="0">
                    <marginalia_text>
                        (17)
                        Queen 
                        Polonius
                        2 Chairs on
                    </marginalia_text>
                    <person name="Queen"/>
                    <person name="Polonius"/>
                </position>
            </language>
        </marginalia>
        
        <substitution method="pen" type="insertion" copyText="&quot; Offences guided hand may shew by justice," amendedText="&quot; Offences guilded hand may shew by justice,"/>
        
        <substitution method="pen" type="insertion" copyText="
            Ham. Where is this murderer, he kneels and prays, | 
            And now I'll do't, and so he goes to heaven, |
            And so am I reveng'd? that would be scann'd; |
            He kill'd my father; and for that |
            I his sole son send him |
            To heaven: |
            Why this is a reward, -- not revenge:"
            amendedText="
            Ham. Where is this murderer? he kneels and prays, | 
            And now I'll do't - and so he goes to heaven,-- |
            And so am I reveng'd? that would be scann'd;-- |
            He kill'd my father;-and for that, |
            I, his sole son, send him |
            To heaven-- |
            Why this is reward, &amp; not revenge:"/>
            
        
        <!-- Symbols and marks -->	<!-- Positions available: head, intext, tail, left_margin, right_margin -->
        <symbol name="Hatching" place="right_margin" text="[Enter Hamlet."/> 
        
        
    </annotation>
</transcription>
