<?xml version="1.0" encoding="UTF-8" standalone="no"?>

<!DOCTYPE transcription SYSTEM "http://www.livesandletters.ac.uk/schema/aor_20141023.dtd">

<transcription xmlns:xsi="http://www.w3.org/2001/XMLSchema-instance"
    xsi:noNamespaceSchemaLocation="https://raw.githubusercontent.com/ChrisRG/ReadingHamlet/master/RHschema.xsd">
    
    <page filename="Hamlet.038v.tif" pagination="76" signature="V.1" reader="John Ward"/> <!-- Signature = act + scene -->
    <annotation>
        <!-- Marginalia -->     <!-- Positions available: head, intext, tail, left_margin, right_margin -->
        <marginalia>
            <language ident="EN">
                <position place="left_margin" book_orientation="0">
                    <marginalia_text>
                        (3)
                        King
                        Queen
                        Laertes
                        Priest
                        Attendants
                        Corpse Supported
                    </marginalia_text>
                    <person name="King"/>
                    <person name="Queen"/>
                    <person name="Laertes"/>
                    <person name="Priest"/>
                    <person name="Attendants"/>
                </position>
            </language>
        </marginalia>
        <marginalia >
            <language ident="EN">
                <position place="left_margin" book_orientation="90">
                    <marginalia_text>
                        Hamlet Prince of Denmark    <!-- Probably a different hand -->
                    </marginalia_text>
                    <person name="Hamlet"/>
                </position>
            </language>
        </marginalia>
        
        <marginalia anchor_text= "And smelt so? Pah." >
            <language ident="EN">
                <position place="intext" book_orientation="0">
                    <marginalia_text>
                        Smelling to the scull
                    </marginalia_text>
                </position>
            </language>
        </marginalia>
       
        
        <!-- Substitutions -->
        <substitution method="pen" type="replacement" copyText="
            Ha. Alas poor Yorick. I knew him Horatio, a fellow of infinite
            jest, of most excellent fancy, he hath bore me on his back a thousand 
            times, and now how abhorred in my imagination it is? my gorge 
            rises at it. Here hung those lips that I have kist I know not how 
            oft: where be your jibes now, your jests, your songs, your flashes of
            merriment, that were wont to set the table on a roar? not one now 
            to mock your own grinning? quite chopfaln? Now get you to
            my Ladies table, and tell her, let her paint an inch thick, to this 
            favour she must come; Make her laugh at that,
            Prethee Horatio, tell me one thing." amendedText="
            
            Ha. Alas poor Yorick! I knew him, Horatio, a fellow of infinite
            jest; of most excellent fancy: he hath bore me in his arms a thousand 
            times: Here hung those lips, that I have kist I know not how 
            oft: where be your jibes now? your jests? your songs? your flashes of 
            merriment, that were wont to set the table in a roar? not one now, 
            to mock your own grinning? quite chopfaln? Now get you to
            my Ladies table, and tell her, let her paint an inch thick, to this 
            favour she must come; 
            Prethee, Horatio, tell me one thing."/>
        
        <substitution method="pen" type="insertion" copyText="
            Ham. Dost thou think Alexander lookt on this fashion i'th' earth?" 
            
            amendedText="
            Ham. Dost thou think, Alexander lookt o' this fashion i'th' earth?" />
        
        <substitution method="pen" type="insertion" copyText="
            Ham. To what base uses we may return Horatio! why may not 
            imagination trace the noble dust of Alexander till he find it 
            stopping a bung hole." amendedText="
                
            Ham. To what base uses we may return, Horatio! why may not 
            imagination trace the noble dust of Alexander, till he find it 
            stopping a bung hole."/>             
    </annotation>
</transcription>


